{
  "$schema": "https://json-schema.org/draft/2020-12/schema",
  "$id": "https://agentcapsule.org/schema/capsule-0.1.schema.json",
  "type": "object",
  "required": ["spec_version", "meta", "runtime", "tools"],
  "additionalProperties": false,
  "properties": {
    "spec_version": { "const": "0.1.0" },
    "meta": {
      "type": "object",
      "required": ["name", "version", "title", "description"],
      "additionalProperties": false,
      "properties": {
        "name": { "type": "string", "pattern": "^[a-z0-9][a-z0-9._-]{0,63}$" },
        "version": { "type": "string", "pattern": "^[0-9]+\\.[0-9]+\\.[0-9]+([-+][0-9A-Za-z.-]+)?$" },
        "title": { "type": "string", "minLength": 1, "maxLength": 80 },
        "description": { "type": "string", "minLength": 1, "maxLength": 500 },
        "author": {
          "type": "object",
          "additionalProperties": false,
          "properties": {
            "name": { "type": "string", "maxLength": 80 },
            "key_id": { "type": "string", "pattern": "^sha256:[0-9a-f]{64}$" }
          }
        }
      }
    },
    "runtime": {
      "type": "object",
      "required": ["type", "entry"],
      "additionalProperties": false,
      "properties": {
        "type": { "const": "quickjs-1" },
        "entry": { "type": "string", "pattern": "^src/[A-Za-z0-9._-]+(/[A-Za-z0-9._-]+)*\\.js$" },
        "memory_limit_mb": { "type": "integer", "minimum": 1, "maximum": 512, "default": 64 },
        "timeout_ms": { "type": "integer", "minimum": 100, "maximum": 60000, "default": 5000 },
        "determinism": { "enum": ["strict"], "default": "strict" }
      }
    },
    "capabilities": {
      "type": "object",
      "additionalProperties": false,
      "properties": {
        "sql": { "type": "boolean", "default": false },
        "kv": { "type": "boolean", "default": false },
        "pack": { "type": "boolean", "default": false },
        "net": {
          "type": "object",
          "additionalProperties": false,
          "properties": {
            "allowed_hosts": {
              "type": "array",
              "maxItems": 32,
              "items": {
                "type": "string",
                "pattern": "^(\\*\\.)?[a-z0-9]([a-z0-9-]*[a-z0-9])?(\\.[a-z0-9]([a-z0-9-]*[a-z0-9])?)+$"
              },
              "default": []
            },
            "allow_localhost": { "type": "boolean", "default": false }
          }
        }
      }
    },
    "tools": {
      "type": "array",
      "minItems": 1,
      "maxItems": 64,
      "items": {
        "type": "object",
        "required": ["name", "title", "description", "inputSchema"],
        "additionalProperties": false,
        "properties": {
          "name": { "type": "string", "pattern": "^[a-zA-Z0-9_-]{1,64}$" },
          "title": { "type": "string", "minLength": 1, "maxLength": 80 },
          "description": { "type": "string", "minLength": 1, "maxLength": 1024 },
          "inputSchema": {
            "type": "object",
            "properties": { "type": { "const": "object" } },
            "required": ["type"]
          },
          "outputSchema": { "type": "object" },
          "effects": {
            "type": "array",
            "default": [],
            "items": {
              "enum": [
                "clock.now",
                "random.bytes",
                "sql.query",
                "sql.exec",
                "kv.get",
                "kv.set",
                "net.fetch",
                "log.write",
                "pack.write"
              ]
            }
          },
          "ui": { "type": "string", "pattern": "^ui://[A-Za-z0-9._/-]+$" }
        }
      }
    },
    "resources": {
      "type": "array",
      "maxItems": 64,
      "items": {
        "type": "object",
        "required": ["uri", "name", "mimeType", "path"],
        "additionalProperties": false,
        "properties": {
          "uri": { "type": "string", "pattern": "^capsule://[A-Za-z0-9._/-]+$" },
          "name": { "type": "string", "maxLength": 80 },
          "mimeType": { "type": "string", "maxLength": 100 },
          "path": { "type": "string", "pattern": "^(src|ui|data)/[A-Za-z0-9._-]+(/[A-Za-z0-9._-]+)*$" }
        }
      }
    },
    "ui": {
      "type": "object",
      "additionalProperties": false,
      "properties": {
        "app": {
          "type": "object",
          "required": ["resourceUri", "path"],
          "additionalProperties": false,
          "properties": {
            "resourceUri": { "type": "string", "pattern": "^ui://[A-Za-z0-9._/-]+$" },
            "path": { "type": "string", "pattern": "^ui/[A-Za-z0-9._-]+(/[A-Za-z0-9._-]+)*\\.html$" },
            "csp": {
              "type": "object",
              "additionalProperties": false,
              "properties": {
                "connectDomains": { "type": "array", "items": { "type": "string" }, "default": [] },
                "resourceDomains": { "type": "array", "items": { "type": "string" }, "default": [] },
                "frameDomains": { "type": "array", "items": { "type": "string" }, "default": [] },
                "baseUriDomains": { "type": "array", "items": { "type": "string" }, "default": [] }
              }
            }
          }
        },
        "local": {
          "type": "object",
          "required": ["path"],
          "additionalProperties": false,
          "properties": {
            "path": { "type": "string", "pattern": "^ui/[A-Za-z0-9._-]+(/[A-Za-z0-9._-]+)*\\.html$" }
          }
        }
      }
    }
  }
}
